{
  "schema": 1,
  "id": "synology-ds1621plus-dsm-7.4.1-90080-k4.4.302plus-x86_64",
  "vendor": "Synology",
  "product": "DS1621+",
  "platform": "v1000",
  "architecture": "x86_64",
  "os": {
    "name": "DSM",
    "version": "7.4.1",
    "build": "90080"
  },
  "kernel": {
    "release": "4.4.302+",
    "vermagic": "4.4.302+ SMP mod_unload"
  },
  "validation": {
    "status": "release-ready",
    "date": "2026-09-25",
    "deployment": "full-container",
    "notes": "VoWiFi, IMS registration, cellular data, hotplug, PC/SC and eSIM listing were validated. The driver pack is rebuilt in CI from Synology's public toolkit and unmodified Linux v4.4.302 sources, reproduces the validated modules byte for byte, and was installed from the pack on the same NAS."
  },
  "host_native": false,
  "required_modules": [
    "mii",
    "cdc-wdm",
    "qmi_wwan",
    "usb_wwan",
    "option"
  ],
  "tested_usb": [
    {
      "vid": "2c7c",
      "pid": "0125",
      "kind": "cellular-modem",
      "result": "working"
    },
    {
      "vid": "04d9",
      "pid": "c001",
      "kind": "pcsc-reader",
      "result": "working"
    }
  ],
  "expected_nodes": [
    "ttyUSB",
    "cdc-wdm",
    "wwan",
    "usb-bus"
  ],
  "driver_pack": {
    "status": "published",
    "asset": "mdd-driver-synology-ds1621plus-dsm7.4.1-90080-k4.4.302plus-x86_64.tar.gz",
    "sha256": "cb5b84a95d4a045f5fb422cdbd2525fe0d45619fc0e5c11fd2853a548b9e1869"
  }
}
